plant_id,scientific_name,family,uses,region,type,description
SHRUB0077,Plumbago zeylanica L.,PLUMBAGINACEAE,"Root is used as a vesicant, abortifacient, and diuretic, and is used in the treatment of dyspepsia, piles, anasarca, diarrhoea, and skin diseases. Root paste is applied for opening abscesses. Root infusion is used in influenza and black-water fever treatment. Root bark contains plumbagin pigment.",Found in various regions of India.,Shrub,"A small tree native to tropical regions, known for its edible fruit and use in traditional medicine for digestive and skin conditions."
TREE0078,Punica granatum L.,PUNICACEAE,The poultice of leaves is applied for boils and sores. The decoction of roots is prescribed for lumbago.,Found in various regions of India.,Tree,"A small tree native to tropical regions, used in traditional medicine for its medicinal fruit and digestive benefits."
HERB0079,Ricinus communis L.,EUPHORBIACEAE,"Root extract is antidysenteric and antiseptic in nature. Leaf and stem decoction is used as a vermifuge and is also a constituent of the drug septilin, which is used for rhinosinal infections.",Found in various regions of India.,Herb,"A tall tree native to Australia, valued for its aromatic leaves and use in traditional medicine for respiratory and anti-inflammatory issues."
HERB0080,Rubia cordifolia L.,RUBIACEAE,"Root extract is antidysenteric and antiseptic in nature. Leaf and stem decoction is used as a vermifuge and is also a constituent of the drug septilin, which is used for rhinosinal infections.",Found in various regions of India.,Herb,"A small tree native to the Mediterranean region, known for its edible fruit and use in traditional medicine for its digestive benefits."
TREE0081,Santalum album L.,SANTALACEAE,"It is antiseptic and antidysenteric, used in cardalgia and gripe. Infusion of the herb is applied to anthrax pustules. The herb is also used as a diuretic and laxative; decoction is narcotic and antispasmodic. Freshly prepared extract of herb is effective in cirrhosis of the liver. Juice of fresh leaves produces dilatation of the pupils. Berries are tonic, diuretic, and cathartic and are used in anasarca and heart diseases. They are employed as a domestic remedy.",Found in tropical regions of India.,Tree,"A large tree native to tropical regions, known for its extensive aerial roots and use in traditional medicine for its anti-inflammatory properties."
HERB0082,Solanum nigrum L.,SOLANACEAE,"Potatoes are used as antiscorbutic, aperient, diuretic, and galactagogue. Extract of leaves is used as antispasmodic in cough. Tuber is ground and made into a paste for application to burns with much benefit.",Found in various regions of India.,Herb,"A large tree native to India, valued for its medicinal leaves and use in traditional medicine for digestive and respiratory issues."
HERB0083,Solanum tuberosum L.,SOLANACEAE,Decoctions of bark and powdered seeds are used in diabetes treatment. Bark is used in gargles and mouthwashes.,Found in various regions of India.,Herb,"A tropical fruit tree native to Southeast Asia, known for its edible fruit and use in traditional medicine for its antioxidant properties."
TREE0084,Syzygium cumini (L.) Skeels,MYRTACEAE,Clove oil is used as a local analgesic for hypersensitive dentines and cavities and is also used for external application as a rubefacient and internally as a carminative and antispasmodic medication.,Found in tropical and subtropical regions of India.,Tree,"A small tree native to tropical and subtropical regions, used in traditional medicine for its anti-inflammatory and antimicrobial properties."
TREE0085,Terminalia bellirica (Gaertn.) Roxb.,COMBRETACEAE,"Fruits are used in the treatment of cough, hoarseness, and scorpion sting and form a constituent of triphala, which is an important Ayurvedic medicine.",Found in tropical regions of India.,Tree,"A small tree native to tropical regions, valued for its nutritious leaves and use in traditional medicine for its anti-inflammatory and antioxidant benefits."
TREE0086,Terminalia chebula Retz.,COMBRETACEAE,"Fruits have laxative, stomachic, and tonic properties and form a constituent of triphala, which is an important Ayurvedic medicine.",Found in tropical regions of India.,Tree,"A small tree native to the Mediterranean region, known for its edible fruit and use in traditional medicine for its antioxidant properties."
HERB0087,Tribulus terrestris L.,ZYGOPHYLLACEAE,"Leaves are rich in calcium but poor in iron. Fruits are used as a tonic and diuretic, also used in painful micturition and calculous infections, and are also prescribed in Bright?s disease. Leaves are stomachic, used as lithontriptic. Roots are aperient.",Found in various regions of India.,Herb,"A small tree native to tropical Asia, known for its fragrant heartwood and use in traditional medicine for its anti-inflammatory and calming effects."
SHRUB0088,Urena lobata L.,MALVACEAE,Decoction of stem and roots is used for flatulent colic. Flowers are expectorant; their infusion is applied in aphthae and sore throat.,Found in tropical regions of India.,Shrub,"A small tree native to tropical regions, known for its edible fruit and use in traditional medicine for its digestive and anti-inflammatory properties."
SHRUB0089,Withania somnifera (L.) Dunal,SOLANACEAE,"Roots are used for treating hiccup, cough, dropsy, rheumatism, and female disorders, and as a sedative in cases of senile debility. It is useful for inflammatory conditions like ulcers and scabies in the form of external applications. Leaves are used as a febrifuge and applied to lesions, painful swellings, and sore eyes.",Found in various regions of India.,Shrub,"A large tree native to tropical Asia, valued for its medicinal fruits used to treat digestive and respiratory issues."
HERB0090,Xanthium strumarium L.,ASTERACEAE,"Herb is diaphoretic, diuretic, emollient, and sedative. Decoction is used in treating chronic malaria, leucorrhoea, and urinary diseases. Buds are tonic, diuretic, and sedative. Seeds are used for resolving inflammatory swellings and their oil for bladder infections, herpes, and erysipelas. Fruits contain anti-inflammatory activity. It is added to pharmaceutical preparations or food products for the regulation of hormonal activity and treatment of urino-genital infections.",Found in various regions of India.,Herb,"A large tree native to tropical Asia, known for its medicinal fruits used in traditional medicine for its digestive and antioxidant properties."
TREE0091,Ziziphus jujuba Mill.,Rhamnaceae,"Bark used for ulcers and wounds. Fruit is nourishing, tonic, emollient, antitussive, antiallergic; protects liver and prevents stress ulcer formation. Seed used for dry cough and skin eruptions. Kernel used in insomnia.",Found in various regions of India.,Tree,"A small tree native to Asia, known for its edible fruit and use in traditional medicine for its digestive and calming properties."
